{
  "api_version": "v1",
  "authority": {
    "authoritative": false,
    "protocol": "RAPP/1",
    "statement": "This generated static discovery surface is non-authoritative. Signed RAPP/1 frames and signed RAPP/1 registries remain the authority.",
    "verification_required": true
  },
  "bootstrap": {
    "note": "Fetch the index first, then verify every seeded item using its full SHA-256.",
    "pages_url": "https://kody-w.github.io/rapp-static-apis/api/rapp-work/v1/index.json",
    "path": "api/rapp-work/v1/index.json",
    "raw_url": "https://raw.githubusercontent.com/kody-w/rapp-static-apis/main/api/rapp-work/v1/index.json"
  },
  "count": 10,
  "fixture_mode": false,
  "generated": "2026-09-18T14:59:20Z",
  "items": [
    {
      "bytes": 8303,
      "name": "discovery",
      "pages_url": "https://kody-w.github.io/rapp-static-apis/api/rapp-work/v1/discovery.json",
      "path": "api/rapp-work/v1/discovery.json",
      "raw_url": "https://raw.githubusercontent.com/kody-w/rapp-static-apis/main/api/rapp-work/v1/discovery.json",
      "sha256": "b9c5a2bdabe8fbbbc9fe7f2bedc0fda0ab0fe07be4a504f4a7a9bc966ac50d30"
    },
    {
      "bytes": 5765,
      "name": "hashes",
      "pages_url": "https://kody-w.github.io/rapp-static-apis/api/rapp-work/v1/hashes.json",
      "path": "api/rapp-work/v1/hashes.json",
      "raw_url": "https://raw.githubusercontent.com/kody-w/rapp-static-apis/main/api/rapp-work/v1/hashes.json",
      "sha256": "0195277037dec4efe967335eb9232053d8285622e9aa0f12a2e85fa4f488458f"
    },
    {
      "bytes": 7987,
      "name": "index",
      "pages_url": "https://kody-w.github.io/rapp-static-apis/api/rapp-work/v1/index.json",
      "path": "api/rapp-work/v1/index.json",
      "raw_url": "https://raw.githubusercontent.com/kody-w/rapp-static-apis/main/api/rapp-work/v1/index.json",
      "sha256": "848530361ba10d469c336cba84f7a379b755ad03c21b3f0193d5b8187eaf6465"
    },
    {
      "bytes": 1148,
      "name": "plugins",
      "pages_url": "https://kody-w.github.io/rapp-static-apis/api/rapp-work/v1/plugins.json",
      "path": "api/rapp-work/v1/plugins.json",
      "raw_url": "https://raw.githubusercontent.com/kody-w/rapp-static-apis/main/api/rapp-work/v1/plugins.json",
      "sha256": "73fbce9a8d3834b62b204b5d13f0502ebe71633e4c75bc824c9af7542e4789c0"
    },
    {
      "bytes": 767,
      "name": "profile",
      "pages_url": "https://kody-w.github.io/rapp-static-apis/api/rapp-work/v1/profile.json",
      "path": "api/rapp-work/v1/profile.json",
      "raw_url": "https://raw.githubusercontent.com/kody-w/rapp-static-apis/main/api/rapp-work/v1/profile.json",
      "sha256": "bb0dd56560c1c1e459ca42a7ea8f6dd2e045aa1ee6a9acbc8bc9b7ec20db1d68"
    },
    {
      "bytes": 2569,
      "name": "releases",
      "pages_url": "https://kody-w.github.io/rapp-static-apis/api/rapp-work/v1/releases.json",
      "path": "api/rapp-work/v1/releases.json",
      "raw_url": "https://raw.githubusercontent.com/kody-w/rapp-static-apis/main/api/rapp-work/v1/releases.json",
      "sha256": "07a0e19d521ace47ff3d90b6de178030cf2a5a1b4202e4a19d6dc59f66cca70a"
    },
    {
      "bytes": 2991,
      "name": "rollback",
      "pages_url": "https://kody-w.github.io/rapp-static-apis/api/rapp-work/v1/rollback.json",
      "path": "api/rapp-work/v1/rollback.json",
      "raw_url": "https://raw.githubusercontent.com/kody-w/rapp-static-apis/main/api/rapp-work/v1/rollback.json",
      "sha256": "fcaeb6c1644b7820c0355c049b438c3cd7f244cda351bffa8abef17b0e62186a"
    },
    {
      "bytes": 1092,
      "name": "sdks",
      "pages_url": "https://kody-w.github.io/rapp-static-apis/api/rapp-work/v1/sdks.json",
      "path": "api/rapp-work/v1/sdks.json",
      "raw_url": "https://raw.githubusercontent.com/kody-w/rapp-static-apis/main/api/rapp-work/v1/sdks.json",
      "sha256": "bb9fd47277a6215445afceed74f2bbdd2c31d34015d462a05534ee9e8940ac3d"
    },
    {
      "bytes": 1131,
      "name": "skills",
      "pages_url": "https://kody-w.github.io/rapp-static-apis/api/rapp-work/v1/skills.json",
      "path": "api/rapp-work/v1/skills.json",
      "raw_url": "https://raw.githubusercontent.com/kody-w/rapp-static-apis/main/api/rapp-work/v1/skills.json",
      "sha256": "3476197124136756de8419cb99e6b9c1f6fcdcacddcf07c6c5e2a65fbc6b7120"
    },
    {
      "bytes": 833,
      "name": "status",
      "pages_url": "https://kody-w.github.io/rapp-static-apis/api/rapp-work/v1/status.json",
      "path": "api/rapp-work/v1/status.json",
      "raw_url": "https://raw.githubusercontent.com/kody-w/rapp-static-apis/main/api/rapp-work/v1/status.json",
      "sha256": "9cc476833935ab372f6a4f3b5e61dfc67cba2ddff61d8ef638d74ab3550849d0"
    }
  ],
  "schema": "rapp-work-static-api-offline-seed/1.0",
  "verification": {
    "algorithm": "sha256",
    "on_mismatch": "reject",
    "required": true
  }
}
